{
  "id": "2bac/elec5_modulation",
  "niveau": "2bac",
  "discipline": "physique",
  "domaine": "Électricité",
  "titre": "Ondes électromagnétiques et communication : modulation d'amplitude",
  "filieres": [
    "PC",
    "SMA",
    "SMB"
  ],
  "duree_h": [
    {
      "filieres": [
        "PC",
        "SMA",
        "SMB"
      ],
      "cours": 8,
      "exercices": 2
    }
  ],
  "source_pages": [
    113,
    127
  ],
  "prerequis": [
    "2bac/elec4_rlc_force"
  ],
  "contenus": [
    "Ondes électromagnétiques ; transmission de l'information.",
    "Modulation d'une tension sinusoïdale.",
    "Modulation d'amplitude : principe ; démodulation.",
    "Réalisation d'un récepteur radio AM."
  ],
  "objectifs": [
    {
      "id": "O1",
      "texte": "Savoir que l'information est transmise par une onde porteuse, sans transport de matière mais avec transport d'énergie."
    },
    {
      "id": "O2",
      "texte": "Connaître l'expression d'une tension sinusoïdale ; une antenne émet et reçoit à la même fréquence que le signal."
    },
    {
      "id": "O3",
      "texte": "Définir la modulation d'amplitude et les conditions pour éviter la surmodulation."
    },
    {
      "id": "O4",
      "texte": "Connaître les étapes de la démodulation ; rôle des filtres et du circuit LC parallèle (circuit bouchon)."
    },
    {
      "id": "O5",
      "texte": "Connaître les éléments d'un récepteur AM et leur rôle."
    }
  ],
  "activites": [
    "Histoire de la transmission de l'information.",
    "Modulation avec un circuit multiplicateur ; démodulation par détecteur d'enveloppe.",
    "Réaliser un récepteur radio AM simple."
  ],
  "orientations": [
    "Discuter la répartition des bandes de fréquences.",
    "Le détecteur d'enveloppe (diode + RC parallèle) est présenté de préférence sans décomposition.",
    "Aucune étude théorique approfondie exigée à l'évaluation ; ne pas faire tracer les courbes des filtres.",
    "Laisser de la liberté à l'élève pour réaliser le récepteur."
  ],
  "hors_programme": [
    "Modulation de fréquence et de phase."
  ]
}
