{
  "id": "2bac/chim6_evolution_spontanee",
  "niveau": "2bac",
  "discipline": "chimie",
  "domaine": "Sens d'évolution d'un système chimique",
  "titre": "Évolution spontanée d'un système chimique",
  "filieres": [
    "SVT",
    "SA",
    "STM",
    "STE",
    "PC",
    "SMA",
    "SMB"
  ],
  "duree_h": [
    {
      "filieres": [
        "SVT",
        "SA",
        "STM",
        "STE"
      ],
      "cours": 6,
      "exercices": 2,
      "pour": "chim6 et chim7"
    },
    {
      "filieres": [
        "PC",
        "SMA",
        "SMB"
      ],
      "cours": 14,
      "exercices": 4,
      "pour": "chim6 à chim8"
    }
  ],
  "source_pages": [
    82,
    102,
    103,
    116,
    142
  ],
  "prerequis": [
    "2bac/chim4_equilibre"
  ],
  "contenus": [
    "Critère d'évolution spontanée : Qr tend vers K au cours du temps.",
    "Application aux réactions acide-base et d'oxydoréduction."
  ],
  "objectifs": [
    {
      "id": "O1",
      "texte": "Écrire Qr et calculer sa valeur dans un état donné."
    },
    {
      "id": "O2",
      "texte": "Prévoir le sens d'évolution spontanée en comparant Qr,i et K."
    }
  ],
  "activites": [
    "Mélanges acide éthanoïque/éthanoate et acide méthanoïque/méthanoate ; Fe2+, Fe3+, poudres de fer et de cuivre."
  ],
  "orientations": [
    "K seule ne permet pas de prévoir le sens ; critère sans considération cinétique : Qr < K sens direct ; Qr > K sens inverse ; Qr = K équilibre.",
    "K n'a de sens qu'associée à une équation écrite avec les plus petits coefficients entiers."
  ],
  "hors_programme": []
}
