{
  "id": "1bac/elec2_transfert_energie",
  "niveau": "1bac",
  "discipline": "physique",
  "domaine": "Électricité",
  "titre": "Transfert d'énergie dans un circuit électrique, puissance électrique",
  "filieres": [
    "SE",
    "ST",
    "SM"
  ],
  "duree_h": [
    {
      "filieres": [
        "SE",
        "ST"
      ],
      "cours": 9,
      "exercices": 2
    },
    {
      "filieres": [
        "SM"
      ],
      "cours": 13,
      "exercices": 3
    }
  ],
  "source_pages": [
    47,
    58,
    59,
    60
  ],
  "prerequis": [
    "tronc_commun/elec3_montages_electriques"
  ],
  "contenus": [
    "Énergie électrique reçue par un récepteur ; puissance électrique.",
    "Effet Joule, loi de Joule, applications.",
    "Énergie fournie par un générateur ; puissance.",
    "Répartition de l'énergie pendant Δt ; rendements (récepteur, générateur, global).",
    "Influence de la f.é.m. et des résistances sur l'énergie fournie (circuit résistif)."
  ],
  "objectifs": [
    {
      "id": "O1",
      "texte": "Expliquer le transfert d'énergie dans un récepteur par la conservation de l'énergie."
    },
    {
      "id": "O2",
      "texte": "Connaître W = (VA - VB)·I·Δt et P = UAB·I (récepteur et générateur)."
    },
    {
      "id": "O3",
      "texte": "Connaître la loi de Joule et ses applications."
    },
    {
      "id": "O4",
      "texte": "Savoir que la puissance électrique est une vitesse de transfert d'énergie."
    },
    {
      "id": "O5",
      "texte": "Savoir que l'énergie fournie par le générateur est reçue par les récepteurs ; calculer des rendements."
    },
    {
      "id": "O6",
      "texte": "Connaître I = E/Req et ses limites."
    }
  ],
  "activites": [
    "Lampe et moteur : transfert d'énergie.",
    "Mesures de U et I pendant Δt : énergie et puissance reçues.",
    "Vérifier la loi de Joule (calorimétrie) ; effet Joule dans la vie courante.",
    "Énergie fournie par le générateur ; influence de E et des résistances."
  ],
  "orientations": [
    "La conservation de l'énergie, vue en mécanique, est étendue au transfert du générateur vers le récepteur en régime permanent.",
    "Utiliser les termes « récepteur » et « générateur » ; préciser le sens du courant pour éviter l'algébrisation de l'intensité : énergie et puissance positives.",
    "Transfert étudié seulement pour une portion soumise à une tension non nulle et traversée par un courant non nul.",
    "Effet Joule : pertes (générateur, lignes à haute tension) mais utile ailleurs (radiateurs, lampes) ; évoquer le rayonnement des lampes.",
    "Circuits à un seul générateur (générateurs en série : les f.é.m. s'additionnent).",
    "I = E/Req seulement pour des circuits ne contenant que des résistances, E constante."
  ],
  "hors_programme": [
    "Algébrisation de l'intensité.",
    "Circuits à plusieurs générateurs non associés en série."
  ],
  "specifique": [
    {
      "filieres": [
        "SM"
      ],
      "contenus": [
        "Bilan énergétique d'un circuit contenant un transistor ou un AO ; composants qui dissipent de la chaleur, refroidissement."
      ],
      "objectifs": [
        {
          "id": "O7",
          "texte": "Faire le bilan énergétique d'un circuit contenant un transistor ou un AO ; rôle de l'alimentation."
        }
      ],
      "activites": [
        "Réaliser expérimentalement le bilan énergétique d'un circuit contenant un transistor.",
        "Montrer le rôle de l'alimentation dans un montage électronique contenant un amplificateur opérationnel."
      ],
      "orientations": [
        "Les composants dont le bilan énergétique montre une dissipation sous forme de chaleur voient leur température augmenter : importance des moyens de refroidissement adaptés."
      ]
    }
  ]
}