{
  "id": "tronc_commun/chim4_atome",
  "niveau": "tronc_commun",
  "discipline": "chimie",
  "domaine": "Constituants de la matière",
  "titre": "Modèle de l'atome",
  "filieres": [
    "TCS",
    "TCT"
  ],
  "duree_h": [
    {
      "filieres": [
        "TCS",
        "TCT"
      ],
      "cours": 4,
      "exercices": 2,
      "pour": "chim4 à chim6"
    }
  ],
  "source_pages": [
    20,
    37
  ],
  "contenus": [
    "Approche historique.",
    "Noyau (protons, neutrons) et électrons ; charge élémentaire ; neutralité électrique.",
    "Masse et dimensions de l'atome.",
    "Élément chimique : isotopes, ions monoatomiques, conservation de l'élément.",
    "Répartition électronique (couches K, L, M) pour 1 ≤ Z ≤ 18."
  ],
  "objectifs": [
    {
      "id": "O1",
      "texte": "Rechercher et trier l'information ; extraire les idées d'un document."
    },
    {
      "id": "O2",
      "texte": "Connaître les constituants de l'atome et le symbole AZX."
    },
    {
      "id": "O3",
      "texte": "Savoir que l'atome est électriquement neutre et que sa masse est concentrée dans le noyau."
    },
    {
      "id": "O4",
      "texte": "Savoir que Z caractérise l'élément et que l'élément se conserve au cours des transformations."
    },
    {
      "id": "O5",
      "texte": "Écrire la formule électronique ; distinguer couches internes et couche externe."
    }
  ],
  "activites": [
    "Recherche historique.",
    "Calcul de la masse d'atomes.",
    "Conservation de l'élément (cuivre, carbone, soufre…).",
    "Cycle naturel du carbone ; abondance des éléments."
  ],
  "orientations": [
    "Attention au vocabulaire : macroscopique (espèce chimique) / microscopique (entités).",
    "AZX : Z numéro atomique, A nombre de nucléons ; ÉVITER l'expression « nombre de masse ».",
    "Introduire par l'expérience de Rutherford ; structure lacunaire ; ordres de grandeur (puissances de dix).",
    "Conservation de l'élément par approche expérimentale avant le cours.",
    "Les transformations qui ne conservent pas les éléments (réactions nucléaires dans le Soleil) sont seulement évoquées.",
    "Insister sur les électrons de la couche externe ; on peut dire qu'ils ne sont pas tous liés de la même façon."
  ],
  "hors_programme": [
    "Énergie des électrons et niveaux d'énergie.",
    "Expression « nombre de masse »."
  ]
}
